{
  "schema_version": "1.0.0",
  "generated_at": "2026-06-26T12:00:00-07:00",
  "days_back": 7,
  "entries": [
    {
      "showtime_film_key": "sinners",
      "film_title": "Sinners",
      "theater_id": "amc-pacific-place-11",
      "theater_name": "AMC Pacific Place 11",
      "first_announced_date": "2026-06-25",
      "last_seen_date": "2026-06-26"
    },
    {
      "showtime_film_key": "indie-film",
      "film_title": "Indie Film",
      "theater_id": "siff-cinema-uptown",
      "theater_name": "SIFF Cinema Uptown",
      "first_announced_date": "2026-06-26",
      "last_seen_date": "2026-06-26"
    },
    {
      "showtime_film_key": "indie-film",
      "film_title": "Indie Film",
      "theater_id": "siff-cinema-uptown",
      "theater_name": "SIFF Cinema Uptown",
      "first_announced_date": "2026-06-26",
      "last_seen_date": "2026-06-26"
    },
    {
      "showtime_film_key": "ghost-film",
      "film_title": "Ghost Film",
      "theater_id": "amc-oak-tree-6",
      "theater_name": "AMC Oak Tree 6",
      "first_announced_date": "2026-06-26",
      "last_seen_date": "2026-06-26"
    },
    {
      "showtime_film_key": "bad-entry",
      "film_title": "",
      "theater_id": "amc-pacific-place-11",
      "theater_name": "AMC Pacific Place 11",
      "first_announced_date": "2026-06-26",
      "last_seen_date": "2026-06-26"
    }
  ]
}
